{
  "schema_version": "1.0",
  "project_id": "demo.alpha",
  "project_name": "Demo Alpha",
  "snapshot_at": "2026-10-11T20:00:00+08:00",
  "source": {
    "branch": "codex/demo-feature",
    "commit_sha": "0a1b2c3d4e5f6a7b8c9d0e1f2a3b4c5d6e7f8a9b",
    "basis": [
      "docs/plan.md",
      "PR #12",
      "C:\\Users\\demo\\notes.md"
    ],
    "tests_rerun": false
  },
  "stage": "integration",
  "summary": "虚构的演示项目：主要功能已接上，正在联调。",
  "overall_progress": null,
  "milestones": [
    {
      "id": "core",
      "title": "核心功能",
      "status": "done",
      "evidence_level": "existing_test",
      "evidence_refs": [
        "tests/core.test.ts"
      ],
      "human_acceptance": "pending"
    },
    {
      "id": "sync",
      "title": "数据同步",
      "status": "in_progress",
      "evidence_level": "repository",
      "evidence_refs": [
        "src/sync.ts"
      ],
      "human_acceptance": "pending"
    },
    {
      "id": "launch",
      "title": "上线",
      "status": "not_started",
      "evidence_level": "self_report",
      "evidence_refs": [],
      "human_acceptance": "pending"
    }
  ],
  "blockers": [
    {
      "title": "等待演示素材",
      "impact": "演示服务器 192.0.2.10 尚未配置"
    }
  ],
  "next_actions": [
    {
      "title": "完成数据同步",
      "priority": "P0",
      "result": "两端数据一致"
    }
  ],
  "needs_morii": [
    {
      "decision": "首页用哪一组演示图？"
    }
  ]
}
